{
  "width": "FULL",
  "refreshRate": 60,
  "paginate": true,
  "paginationRate": 60,
  "checksPerPage": 15,
  "useTagsAndOperator": false,
  "hideTags": false,
  "enableIncidents": false,
  "expandChecks": false,
  "showHeader": true,
  "isPrivate": false,
  "showP95": true,
  "showP99": true,
  "customUrl": "gsam07",
  "favicon": "https://www.flaticon.com/free-icon/github-logo_25231",
  "link": "https://github.com/gokulsam07/checkly",
  "header": "Gokul's Dashboard",
  "description": "Sample dashboard created for automation check"
}